{
  "metadata": {
    "schema_version": "mg0b.alphatrade_compatibility_audit.v1",
    "sprint": "MG0-B AlphaTrade Compatibility Audit + MarketGenome Scaffold",
    "generated_at": "2026-07-13T15:00:27+08:00",
    "audited_branch": "feature/market-genome-mg0",
    "audited_source_head": "72df1cc1e340f85447f2d4a0c488a15a20c0b2a1",
    "audit_status": "COMPLETE_WITH_DOCUMENTED_BOUNDARIES",
    "gate_decision": "PASS_WITH_DOCUMENTED_BOUNDARIES",
    "implementation_scope": "SCAFFOLD_ONLY"
  },
  "markdown_sha256": "b11c2dc7c5784d635480df7c3f5031c4b036a47a0e089f74ec45dac26df5c7a5",
  "source_evidence": {
    "documents": [
      {
        "path": "docs/market_genome/AlphaTrade_MarketGenome_Implementation_Plan_and_Codex_Prompts.md",
        "sha256": "a795aececd86e731d12ac1e34e3c44939286f1077a8e91aec67334c07fe05880",
        "role": "MG0-B requirements and acceptance gate"
      },
      {
        "path": "docs/market_genome/AlphaTrade_MarketGenome_Technical_Report.md",
        "sha256": "f64d526f361d1f3fa5a5427b0fdc8d4b16b6c721543d7c7cc688ceb58a745cea",
        "role": "MarketGenome design boundary and M12 interpretation"
      }
    ],
    "inspected_files": [
      "src/alphatrade/core/model.py",
      "src/alphatrade/core/causal_layers.py",
      "src/alphatrade/core/causal_attention.py",
      "src/alphatrade/core/losses.py",
      "src/alphatrade/core/schemas.py",
      "src/alphatrade/data_pipeline/archive_reader.py",
      "src/alphatrade/data_pipeline/db_connector.py",
      "src/alphatrade/data_pipeline/feature_profiles.py",
      "src/alphatrade/window_cache.py",
      "src/alphatrade/inference.py",
      "src/alphatrade/prediction_schema.py",
      "src/alphatrade/runtime_paths.py",
      "src/alphatrade/scripts/build_continuous_bars.py",
      "src/alphatrade/scripts/train_m4_alphatrade.py",
      "src/alphatrade/scripts/run_m5_sweep.py",
      "src/alphatrade/scripts/run_iteration.py",
      "src/alphatrade/scripts/export_model_bundle.py",
      "src/alphatrade/scripts/batch_infer_offline.py",
      "src/alphatrade/scripts/build_m10_prediction_eval.py",
      "src/alphatrade/scripts/build_m11_scale_calibration_report.py",
      "src/alphatrade/scripts/build_m11_closure.py",
      "src/alphatrade/scripts/validate_reports_schema.py",
      "src/alphatrade/schemas/contracts_manifest.yaml",
      "docs/m8_iteration_loop.md",
      "docs/m11_calibration_target_scaling_contract.md",
      "docs/reports_governance.md"
    ],
    "evidence_boundaries": [
      "Code locators establish current implementation behavior; one legacy control test imported JAX with a forced CPU backend, but no JAX computation/model runtime was executed in MG0-B.",
      "M12 metrics are historical evidence read from the authoritative formal run and were not recomputed.",
      "Compatibility classifications describe reuse boundaries, not implemented MarketGenome capabilities.",
      "The untracked planning documents are user-provided inputs and are not part of this commit."
    ]
  },
  "resolved_config": {
    "schema_version": "market_genome.scaffold_config.v1",
    "milestone": "MG0-B",
    "model_line": "market_genome",
    "report_profile": "mg0b",
    "implementation_scope": "SCAFFOLD_ONLY",
    "full_backbone_implemented": false,
    "training_enabled": false,
    "gpu_required": false,
    "pair_stack_status": "DEFERRED",
    "ontology_status": "NOT_IMPLEMENTED",
    "dense_track_schema_status": "NOT_IMPLEMENTED"
  },
  "resolved_config_sha256": "927c4775b7a857b2346dbfbe44c101cac9d8471b795a8f0733a02201dab9d451",
  "m12_evidence": {
    "run_root": "/data/alphatrade/runs/m12_chg_formal5_20260626_parallel",
    "historical_source_commit": "d6d050f6184f03e4fc5a426296226e9376e26ce6",
    "artifacts": [
      {
        "path": "/data/alphatrade/runs/m12_chg_formal5_20260626_parallel/reports/M12_CHG_FORMAL_DECISION_MEMO.md",
        "sha256": "04e5df55d8e74c983a5bb838cf7040af772a5215fbb53401222688a8fdff3afc",
        "role": "Authoritative formal decision memo"
      },
      {
        "path": "/data/alphatrade/runs/m12_chg_formal5_20260626_parallel/reports/m12_formal_decision_summary.json",
        "sha256": "9e3cc22a3646a9a1e8945631628c51dbfbce96b6feaea8795f90e9f61ce9cfb5",
        "role": "Machine-readable leaderboard and M10/M11 quality evidence"
      },
      {
        "path": "/data/alphatrade/runs/m12_chg_formal5_20260626_parallel/reports/m12_schema_validation.json",
        "sha256": "98d9b73f8ad877622f21fbcefcfcdc631e54cf88b9b5d9280387701cfc8eec0c",
        "role": "M12 data-contract schema and semantic validation"
      },
      {
        "path": "/data/alphatrade/runs/m12_chg_formal5_20260626_parallel/reports/m12_formal_data_contract_spotcheck.json",
        "sha256": "4c6465e8d3f4124301f0a467b8ec4c484cb7c13b8f5a1c72d0d84b951a0e0462",
        "role": "Formal data-contract spotcheck"
      },
      {
        "path": "/data/alphatrade/runs/m12_chg_formal5_20260626_parallel/reports/formal_sweep/m5_sweep_manifest.json",
        "sha256": "b220773b76b9ef75bc0d546d464affcbe3a8767670a6706c02a5b5f87d407b77",
        "role": "Seven-experiment, three-seed formal run manifest"
      }
    ],
    "run_completion": {
      "experiment_count": 7,
      "seeds": [42, 43, 44],
      "run_count": 21,
      "steps_per_run": 3000,
      "workload": "HISTORICAL_NON_SMOKE_CUDA_RUNS_NOT_RERUN_IN_MG0B"
    },
    "engineering_contract_status": "PASS",
    "spotcheck_status": "PASS",
    "schema_validation_status": "PASS",
    "formal_sweep_completion": "PASS",
    "model_quality_status": "FAIL_MODEL_QUALITY",
    "formal_decision": "FAIL",
    "promotion_status": "REJECTED",
    "schema_validation": {
      "schema_passed": 2,
      "schema_total": 2,
      "semantic_passed": 15,
      "semantic_total": 15,
      "model_quality_status": null
    },
    "m11_closure": {
      "schema_passed": 9,
      "schema_total": 9,
      "semantic_passed": 8,
      "semantic_total": 9,
      "failed_semantics": ["output_calibration_problem_confirmed"]
    },
    "leaderboard_summary": {
      "control_exp_id": "base8_control_common_rows",
      "control_primary_mean": 0.0012521361622341064,
      "best_candidate_exp_id": "chg_core_no_m5",
      "best_candidate_primary_mean": 0.0013347068852399642,
      "chg_core_primary_mean": 0.0015268211131357744,
      "all_processed_candidates_worse_than_control": true
    },
    "base8_quality_summary": {
      "raw_pinball": 0.0011936268421304148,
      "rolling_baseline_pinball": 0.0008602891155530023,
      "calibrated_pinball": 0.0008975829278504696,
      "calibrated_still_worse_than_rolling": true
    },
    "interpretation": "M12 validates the engineering/data-contract path but rejects every processed-feature candidate for promotion. This neither proves model quality nor disproves the separate MarketGenome hypothesis."
  },
  "compatibility_matrix": [
    {
      "subsystem_id": "data_ingestion",
      "subsystem": "Archive data ingestion",
      "classification": "REUSE_WITH_ADAPTER",
      "evidence": [
        {"path": "src/alphatrade/data_pipeline/archive_reader.py", "start_line": 64, "end_line": 145, "claim": "The reader applies manifest/date filters, sorting, EOB de-duplication, and base-column validation."}
      ],
      "observed_current_behavior": "The reader reliably returns ordered OHLCV/OI bars from the existing archive contract.",
      "reuse_boundary": "Reuse reading, filtering, ordering, and base validation; do not treat its returned frame as a complete long-sequence identity/availability contract.",
      "market_genome_action": "Add identity, session, missingness, time-slot, source-version, and resolution metadata in a new dataset adapter.",
      "risk": "Without explicit availability masks, zero-filled missing features become observationally indistinguishable from real zeros.",
      "verification": "SOURCE_VERIFIED; adapter runtime remains deferred."
    },
    {
      "subsystem_id": "continuous_contract_mapping",
      "subsystem": "Continuous futures contract mapping",
      "classification": "REUSE_WITH_ADAPTER",
      "evidence": [
        {"path": "src/alphatrade/scripts/build_continuous_bars.py", "start_line": 149, "end_line": 176, "claim": "Bars are joined to the trading-date continuous map using real contract symbols."}
      ],
      "observed_current_behavior": "The pipeline stitches the mapped real contract for each trading date and audits switches in aggregate.",
      "reuse_boundary": "Reuse authoritative contract selection and stitch ordering; aggregate switch counts are not sufficient as per-position model inputs.",
      "market_genome_action": "Emit roll boundary, active contract identity, contract age, gap/session masks, and provenance tracks without modifying the current continuous-bar output.",
      "risk": "An unmarked roll can be learned as a price motif or contaminate dense targets.",
      "verification": "SOURCE_VERIFIED; dense roll tracks are not implemented."
    },
    {
      "subsystem_id": "feature_profiles",
      "subsystem": "Feature profile contracts",
      "classification": "REUSE_WITH_ADAPTER",
      "evidence": [
        {"path": "src/alphatrade/data_pipeline/feature_profiles.py", "start_line": 31, "end_line": 54, "claim": "FeatureProfile records ordered columns, dimension, source schema, scaler, normalization, and fingerprint metadata."},
        {"path": "src/alphatrade/data_pipeline/feature_profiles.py", "start_line": 82, "end_line": 162, "claim": "Profile resolution and fingerprint checks are centralized and fail on mismatches."}
      ],
      "observed_current_behavior": "M12 already supports dynamic feature dimensions and train-only scaler provenance through typed profiles.",
      "reuse_boundary": "Reuse ordered-column, scaler, normalization, and fingerprint contracts; the current profile lacks modality, resolution, identity, and availability-mask semantics.",